,Id,Name,Year,Rating,Genres,Popularity,Metascore,Director,Writers,Stars,Gross,Budget,Link
0,1,The Shawshank Redemption,1994,9.3,Drama,82,81,Frank Darabont,"Stephen King(based on the short novel ""Rita Hayworth and the Shawshank Redemption"" by)Frank Darabont(screenplay by)","Tim Robbins, Morgan Freeman, Bob Gunton",28884504,25000000,https://www.imdb.com/title/tt0111161/
1,2,The Godfather,1972,9.2,"Crime, Drama",97,100,Francis Ford Coppola,Mario Puzo(screenplay by)Francis Ford Coppola(screenplay by),"Marlon Brando, Al Pacino, James Caan",250341816,6000000,https://www.imdb.com/title/tt0068646/
2,3,The Dark Knight,2008,9.0,"Action, Crime, Drama",136,84,Christopher Nolan,Jonathan Nolan(screenplay)Christopher Nolan(screenplay)David S. Goyer(story),"Christian Bale, Heath Ledger, Aaron Eckhart",1006234167,185000000,https://www.imdb.com/title/tt0468569/
3,4,The Godfather Part II,1974,9.0,"Crime, Drama",548,90,Francis Ford Coppola,Francis Ford Coppola(screenplay by)Mario Puzo(screenplay by),"Al Pacino, Robert De Niro, Robert Duvall",47961919,13000000,https://www.imdb.com/title/tt0071562/
4,5,12 Angry Men,1957,9.0,"Crime, Drama",340,96,Sidney Lumet,"Reginald Rose(teleplay ""Twelve Angry Men"")","Henry Fonda, Lee J. Cobb, Martin Balsam",955,350000,https://www.imdb.com/title/tt0050083/
5,6,Schindler's List,1993,9.0,"Biography, Drama, History",256,94,Steven Spielberg,Thomas Keneally(book)Steven Zaillian(screenplay),"Liam Neeson, Ralph Fiennes, Ben Kingsley",322161245,22000000,https://www.imdb.com/title/tt0108052/
6,7,The Lord of the Rings: The Return of the King,2003,9.0,"Action, Adventure, Drama",247,94,Peter Jackson,"J.R.R. Tolkien(novel ""The Return of the King"")Fran Walsh(screenplay)Philippa Boyens(screenplay)","Elijah Wood, Viggo Mortensen, Ian McKellen",1146436214,94000000,https://www.imdb.com/title/tt0167260/
7,8,Pulp Fiction,1994,8.9,"Crime, Drama",108,94,Quentin Tarantino,Quentin Tarantino(stories by)Roger Avary(stories by),"John Travolta, Uma Thurman, Samuel L. Jackson",213928762,8000000,https://www.imdb.com/title/tt0110912/
8,9,The Lord of the Rings: The Fellowship of the Ring,2001,8.8,"Action, Adventure, Drama",99,92,Peter Jackson,"J.R.R. Tolkien(novel ""The Fellowship of the Ring"")Fran Walsh(screenplay)Philippa Boyens(screenplay)","Elijah Wood, Ian McKellen, Orlando Bloom",898182036,93000000,https://www.imdb.com/title/tt0120737/
9,10,"Il buono, il brutto, il cattivo",1966,8.8,"Adventure, Western",631,90,Sergio Leone,Luciano Vincenzoni(story)Sergio Leone(story)Agenore Incrocci(screenplay),"Clint Eastwood, Eli Wallach, Lee Van Cleef",25253887,1200000,https://www.imdb.com/title/tt0060196/
10,11,Forrest Gump,1994,8.8,"Drama, Romance",201,82,Robert Zemeckis,Winston Groom(novel)Eric Roth(screenplay),"Tom Hanks, Robin Wright, Gary Sinise",678226465,55000000,https://www.imdb.com/title/tt0109830/
11,12,Fight Club,1999,8.8,Drama,137,66,David Fincher,Chuck Palahniuk(based on the novel by)Jim Uhls(screenplay by),"Brad Pitt, Edward Norton, Meat Loaf",101209702,63000000,https://www.imdb.com/title/tt0137523/
12,13,The Lord of the Rings: The Two Towers,2002,8.8,"Action, Adventure, Drama",385,87,Peter Jackson,"J.R.R. Tolkien(novel ""The Two Towers"")Fran Walsh(screenplay)Philippa Boyens(screenplay)","Elijah Wood, Ian McKellen, Viggo Mortensen",947939315,94000000,https://www.imdb.com/title/tt0167261/
13,14,Inception,2010,8.8,"Action, Adventure, Sci-Fi",182,74,Christopher Nolan,Christopher Nolan,"Leonardo DiCaprio, Joseph Gordon-Levitt, Elliot Page",836848102,160000000,https://www.imdb.com/title/tt1375666/
14,15,The Empire Strikes Back,1980,8.7,"Action, Adventure, Fantasy",1041,82,Irvin Kershner,Leigh Brackett(screenplay by)Lawrence Kasdan(screenplay by)George Lucas(story by),"Mark Hamill, Harrison Ford, Carrie Fisher",538375067,18000000,https://www.imdb.com/title/tt0080684/
15,16,The Matrix,1999,8.7,"Action, Sci-Fi",295,73,Lana WachowskiLilly Wachowski,Lilly WachowskiLana Wachowski,"Keanu Reeves, Laurence Fishburne, Carrie-Anne Moss",467222728,63000000,https://www.imdb.com/title/tt0133093/
16,17,Goodfellas,1990,8.7,"Biography, Crime, Drama",192,90,Martin Scorsese,"Nicholas Pileggi(book ""Wiseguy"")Martin Scorsese(screenplay)","Robert De Niro, Ray Liotta, Joe Pesci",47036784,25000000,https://www.imdb.com/title/tt0099685/
17,18,One Flew Over the Cuckoo's Nest,1975,8.7,Drama,439,84,Milos Forman,Lawrence Hauben(screenplay)Bo Goldman(screenplay)Ken Kesey(based on the novel by),"Jack Nicholson, Louise Fletcher, Michael Berryman",109114817,3000000,https://www.imdb.com/title/tt0073486/
18,19,Se7en,1995,8.6,"Crime, Drama, Mystery",204,65,David Fincher,Andrew Kevin Walker,"Morgan Freeman, Brad Pitt, Kevin Spacey",327333559,33000000,https://www.imdb.com/title/tt0114369/
19,20,Shichinin no samurai,1954,8.6,"Action, Drama",1829,98,Akira Kurosawa,Akira Kurosawa(screenplay by)Shinobu Hashimoto(screenplay by)Hideo Oguni(screenplay by),"Toshirô Mifune, Takashi Shimura, Keiko Tsushima",346258,125000000,https://www.imdb.com/title/tt0047478/
20,21,It's a Wonderful Life,1946,8.6,"Drama, Family, Fantasy",1044,89,Frank Capra,Frances Goodrich(screenplay by)Albert Hackett(screenplay by)Frank Capra(screenplay by),"James Stewart, Donna Reed, Lionel Barrymore",6184298,3180000,https://www.imdb.com/title/tt0038650/
21,22,The Silence of the Lambs,1991,8.6,"Crime, Drama, Thriller",144,85,Jonathan Demme,Thomas Harris(based on the novel by)Ted Tally(screenplay by),"Jodie Foster, Anthony Hopkins, Lawrence A. Bonney",272742922,19000000,https://www.imdb.com/title/tt0102926/
22,23,Cidade de Deus,2002,8.6,"Crime, Drama",433,79,Fernando MeirellesKátia Lund(co-director),Paulo Lins(novel)Bráulio Mantovani(screenplay),"Alexandre Rodrigues, Leandro Firmino, Matheus Nachtergaele",30680793,3300000,https://www.imdb.com/title/tt0317248/
23,24,Saving Private Ryan,1998,8.6,"Drama, War",482,91,Steven Spielberg,Robert Rodat,"Tom Hanks, Matt Damon, Tom Sizemore",482349603,70000000,https://www.imdb.com/title/tt0120815/
24,25,La vita è bella,1997,8.6,"Comedy, Drama, Romance",647,59,Roberto Benigni,Vincenzo Cerami(story by)Roberto Benigni(story by),"Roberto Benigni, Nicoletta Braschi, Giorgio Cantarini",230098753,20000000,https://www.imdb.com/title/tt0118799/
25,26,Interstellar,2014,8.6,"Adventure, Drama, Sci-Fi",101,74,Christopher Nolan,Jonathan NolanChristopher Nolan,"Matthew McConaughey, Anne Hathaway, Jessica Chastain",773897851,165000000,https://www.imdb.com/title/tt0816692/
26,27,The Green Mile,1999,8.6,"Crime, Drama, Fantasy",367,61,Frank Darabont,Stephen King(novel)Frank Darabont(screenplay),"Tom Hanks, Michael Clarke Duncan, David Morse",286801374,60000000,https://www.imdb.com/title/tt0120689/
27,28,Star Wars,1977,8.6,"Action, Adventure, Fantasy",360,90,George Lucas,George Lucas,"Mark Hamill, Harrison Ford, Carrie Fisher",775398007,11000000,https://www.imdb.com/title/tt0076759/
28,29,Terminator 2: Judgment Day,1991,8.6,"Action, Sci-Fi",543,75,James Cameron,James CameronWilliam Wisher,"Arnold Schwarzenegger, Linda Hamilton, Edward Furlong",520881154,102000000,https://www.imdb.com/title/tt0103064/
29,30,Back to the Future,1985,8.5,"Adventure, Comedy, Sci-Fi",196,87,Robert Zemeckis,Robert ZemeckisBob Gale,"Michael J. Fox, Christopher Lloyd, Lea Thompson",383336762,19000000,https://www.imdb.com/title/tt0088763/
30,31,Sen to Chihiro no kamikakushi,2001,8.6,"Animation, Adventure, Family",355,96,Hayao Miyazaki,Hayao Miyazaki,"Daveigh Chase, Suzanne Pleshette, Miyu Irino",355725195,19000000,https://www.imdb.com/title/tt0245429/
31,32,Psycho,1960,8.5,"Horror, Mystery, Thriller",281,97,Alfred Hitchcock,Joseph Stefano(screenplay by)Robert Bloch(based on the novel by),"Anthony Perkins, Janet Leigh, Vera Miles",32052925,806947,https://www.imdb.com/title/tt0054215/
32,33,The Pianist,2002,8.5,"Biography, Drama, Music",712,85,Roman Polanski,Ronald Harwood(screenplay by)Wladyslaw Szpilman(based on the book by),"Adrien Brody, Thomas Kretschmann, Frank Finlay",120072577,35000000,https://www.imdb.com/title/tt0253474/
33,34,Gisaengchung,2019,8.5,"Drama, Thriller",172,96,Bong Joon Ho,Bong Joon Ho(story by)Han Jin-won(screenplay by),"Song Kang-ho, Lee Sun-kyun, Cho Yeo-jeong",262676096,11400000,https://www.imdb.com/title/tt6751668/
34,35,Léon,1994,8.5,"Action, Crime, Drama",255,64,Luc Besson,Luc Besson,"Jean Reno, Gary Oldman, Natalie Portman",19569225,115000000,https://www.imdb.com/title/tt0110413/
35,36,The Lion King,1994,8.5,"Animation, Adventure, Drama",563,88,Roger AllersRob Minkoff,Irene Mecchi(screenplay by)Jonathan Roberts(screenplay by)Linda Woolverton(screenplay by),"Matthew Broderick, Jeremy Irons, James Earl Jones",1063611805,45000000,https://www.imdb.com/title/tt0110357/
36,37,Gladiator,2000,8.5,"Action, Adventure, Drama",272,67,Ridley Scott,David Franzoni(story)John Logan(screenplay)William Nicholson(screenplay),"Russell Crowe, Joaquin Phoenix, Connie Nielsen",465380802,103000000,https://www.imdb.com/title/tt0172495/
37,38,American History X,1998,8.5,"Crime, Drama",655,62,Tony Kaye,David McKenna,"Edward Norton, Edward Furlong, Beverly D'Angelo",23875127,20000000,https://www.imdb.com/title/tt0120586/
38,39,The Departed,2006,8.5,"Crime, Drama, Thriller",345,85,Martin Scorsese,William Monahan(screenplay)Alan Mak(2002 screenplay Mou gaan dou)Felix Chong(2002 screenplay Mou gaan dou),"Leonardo DiCaprio, Matt Damon, Jack Nicholson",291480452,90000000,https://www.imdb.com/title/tt0407887/
39,40,The Usual Suspects,1995,8.5,"Crime, Drama, Mystery",479,77,Bryan Singer,Christopher McQuarrie,"Kevin Spacey, Gabriel Byrne, Chazz Palminteri",23341568,6000000,https://www.imdb.com/title/tt0114814/
40,41,The Prestige,2006,8.5,"Drama, Mystery, Sci-Fi",361,66,Christopher Nolan,Jonathan Nolan(screenplay)Christopher Nolan(screenplay)Christopher Priest(novel),"Christian Bale, Hugh Jackman, Scarlett Johansson",109676311,40000000,https://www.imdb.com/title/tt0482571/
41,42,Whiplash,2014,8.5,"Drama, Music",257,88,Damien Chazelle,Damien Chazelle,"Miles Teller, J.K. Simmons, Melissa Benoist",49396747,3300000,https://www.imdb.com/title/tt2582802/
42,43,Casablanca,1942,8.5,"Drama, Romance, War",983,100,Michael Curtiz,Julius J. Epstein(screenplay)Philip G. Epstein(screenplay)Howard Koch(screenplay),"Humphrey Bogart, Ingrid Bergman, Paul Henreid",4539031,950000,https://www.imdb.com/title/tt0034583/
43,44,The Intouchables,2011,8.5,"Biography, Comedy, Drama",821,57,Olivier NakacheÉric Toledano,Olivier NakachePhilippe Pozzo di Borgo(adapted from his autobiographical tale Le Second Souffle)Éric Toledano,"François Cluzet, Omar Sy, Anne Le Ny",426588510,9500000,https://www.imdb.com/title/tt1675434/
44,45,Seppuku,1962,8.6,"Action, Drama, Mystery",3566,85,Masaki Kobayashi,"Yasuhiko Takiguchi(novel ""Ibun rônin ki"")Shinobu Hashimoto(screenplay)","Tatsuya Nakadai, Akira Ishihama, Shima Iwashita",15222,0,https://www.imdb.com/title/tt0056058/
45,46,Hotaru no haka,1988,8.5,"Animation, Drama, War",1402,94,Isao Takahata,Akiyuki Nosaka(novel)Isao Takahata,"Tsutomu Tatsumi, Ayano Shiraishi, Akemi Yamaguchi",516962,3700000,https://www.imdb.com/title/tt0095327/
46,47,Modern Times,1936,8.5,"Comedy, Drama, Romance",4851,96,Charles Chaplin,Charles Chaplin,"Charles Chaplin, Paulette Goddard, Henry Bergman",463618,1500000,https://www.imdb.com/title/tt0027977/
47,48,Once Upon a Time in the West,1968,8.5,Western,1175,80,Sergio Leone,Sergio Donati(screenplay by)Sergio Leone(screenplay by)Dario Argento(from a story by),"Henry Fonda, Charles Bronson, Claudia Cardinale",5434825,5000000,https://www.imdb.com/title/tt0064116/
48,49,Rear Window,1954,8.5,"Mystery, Thriller",1408,100,Alfred Hitchcock,John Michael Hayes(screenplay)Cornell Woolrich(short story),"James Stewart, Grace Kelly, Wendell Corey",37034579,1000000,https://www.imdb.com/title/tt0047396/
49,50,Alien,1979,8.5,"Horror, Sci-Fi",208,89,Ridley Scott,Dan O'Bannon(screenplay by)Ronald Shusett(story by),"Sigourney Weaver, Tom Skerritt, John Hurt",106285522,11000000,https://www.imdb.com/title/tt0078748/
50,51,City Lights,1931,8.5,"Comedy, Drama, Romance",4906,99,Charles Chaplin,Charles ChaplinHarry Carr(uncredited)Harry Crocker(uncredited),"Charles Chaplin, Virginia Cherrill, Florence Lee",50419,1500000,https://www.imdb.com/title/tt0021749/
51,52,Nuovo Cinema Paradiso,1988,8.5,"Drama, Romance",2180,80,Giuseppe Tornatore,Giuseppe Tornatore(story)Vanna Paoli(collaborating writer),"Philippe Noiret, Enzo Cannavale, Antonella Attili",13019063,5000000,https://www.imdb.com/title/tt0095765/
52,53,Apocalypse Now,1979,8.5,"Drama, Mystery, War",558,94,Francis Ford Coppola,John MiliusFrancis Ford CoppolaMichael Herr(narration),"Martin Sheen, Marlon Brando, Robert Duvall",104729466,31500000,https://www.imdb.com/title/tt0078788/
53,54,Memento,2000,8.4,"Mystery, Thriller",560,80,Christopher Nolan,"Christopher Nolan(screenplay)Jonathan Nolan(short story ""Memento Mori"")","Guy Pearce, Carrie-Anne Moss, Joe Pantoliano",40047078,9000000,https://www.imdb.com/title/tt0209144/
54,55,Raiders of the Lost Ark,1981,8.4,"Action, Adventure",737,85,Steven Spielberg,Lawrence Kasdan(screenplay by)George Lucas(story by)Philip Kaufman(story by),"Harrison Ford, Karen Allen, Paul Freeman",389925971,18000000,https://www.imdb.com/title/tt0082971/
55,56,Django Unchained,2012,8.4,"Drama, Western",317,81,Quentin Tarantino,Quentin Tarantino,"Jamie Foxx, Christoph Waltz, Leonardo DiCaprio",426074373,100000000,https://www.imdb.com/title/tt1853728/
56,57,WALL·E,2008,8.4,"Animation, Adventure, Family",1095,95,Andrew Stanton,Andrew Stanton(original story by)Pete Docter(original story by)Jim Reardon(screenplay by),"Ben Burtt, Elissa Knight, Jeff Garlin",521311890,180000000,https://www.imdb.com/title/tt0910970/
57,58,The Lives of Others,2006,8.4,"Drama, Mystery, Thriller",1265,89,Florian Henckel von Donnersmarck,Florian Henckel von Donnersmarck,"Ulrich Mühe, Martina Gedeck, Sebastian Koch",77356942,2000000,https://www.imdb.com/title/tt0405094/
58,59,Sunset Blvd.,1950,8.4,"Drama, Film-Noir",2793,0,Billy Wilder,Charles BrackettBilly WilderD.M. Marshman Jr.,"William Holden, Gloria Swanson, Erich von Stroheim",300073,1752000,https://www.imdb.com/title/tt0043014/
59,60,Paths of Glory,1957,8.4,"Drama, War",2765,90,Stanley Kubrick,Stanley Kubrick(screenplay)Calder Willingham(screenplay)Jim Thompson(screenplay),"Kirk Douglas, Ralph Meeker, Adolphe Menjou",5252,935000,https://www.imdb.com/title/tt0050825/
60,61,The Great Dictator,1940,8.4,"Comedy, Drama, War",4269,0,Charles Chaplin,Charles Chaplin,"Charles Chaplin, Paulette Goddard, Jack Oakie",970263,2000000,https://www.imdb.com/title/tt0032553/
61,62,The Shining,1980,8.4,"Drama, Horror",64,66,Stanley Kubrick,Stephen King(based upon the novel by)Stanley Kubrick(screenplay by)Diane Johnson(screenplay by),"Jack Nicholson, Shelley Duvall, Danny Lloyd",47334824,19000000,https://www.imdb.com/title/tt0081505/
62,63,Avengers: Infinity War,2018,8.4,"Action, Adventure, Sci-Fi",406,68,Anthony RussoJoe Russo,Christopher Markus(screenplay by)Stephen McFeely(screenplay by)Stan Lee(based on the Marvel comics by),"Robert Downey Jr., Chris Hemsworth, Mark Ruffalo",2048359754,321000000,https://www.imdb.com/title/tt4154756/
63,64,Witness for the Prosecution,1957,8.4,"Crime, Drama, Mystery",3542,76,Billy Wilder,Agatha Christie(in Agatha Christie's international stage success)Billy Wilder(screen play)Harry Kurnitz(screen play),"Tyrone Power, Marlene Dietrich, Charles Laughton",7693,3000000,https://www.imdb.com/title/tt0051201/
64,65,Aliens,1986,8.4,"Action, Adventure, Sci-Fi",388,84,James Cameron,James Cameron(story by)David Giler(story by)Walter Hill(story by),"Sigourney Weaver, Michael Biehn, Carrie Henn",131060248,18500000,https://www.imdb.com/title/tt0090605/
65,66,American Beauty,1999,8.4,Drama,205,84,Sam Mendes,Alan Ball,"Kevin Spacey, Annette Bening, Thora Birch",356296601,15000000,https://www.imdb.com/title/tt0169547/
66,67,Spider-Man: Into the Spider-Verse,2018,8.4,"Animation, Action, Adventure",453,87,Bob PersichettiPeter RamseyRodney Rothman,Phil Lord(screenplay by)Rodney Rothman(screenplay by),"Shameik Moore, Jake Johnson, Hailee Steinfeld",384256930,90000000,https://www.imdb.com/title/tt4633694/
67,68,Dr. Strangelove or: How I Learned to Stop Worrying and Love the Bomb,1964,8.4,"Comedy, War",1401,97,Stanley Kubrick,Stanley Kubrick(screenplay)Terry Southern(screenplay)Peter George(screenplay),"Peter Sellers, George C. Scott, Sterling Hayden",9523464,1800000,https://www.imdb.com/title/tt0057012/
68,69,The Dark Knight Rises,2012,8.4,"Action, Drama",461,78,Christopher Nolan,Jonathan Nolan(screenplay)Christopher Nolan(screenplay)David S. Goyer(story),"Christian Bale, Tom Hardy, Anne Hathaway",1081169825,250000000,https://www.imdb.com/title/tt1345836/
69,70,Oldeuboi,2003,8.4,"Action, Drama, Mystery",431,77,Park Chan-wook,"Garon Tsuchiya(manga)Nobuaki Minegishi(manga)Park Chan-wook(character created by: Oldboy, Vengeance Trilogy)","Choi Min-sik, Yoo Ji-tae, Kang Hye-jeong",15415204,3000000,https://www.imdb.com/title/tt0364569/
70,71,Joker,2019,8.4,"Crime, Drama, Thriller",164,59,Todd Phillips,Todd PhillipsScott SilverBob Kane(based on characters created by),"Joaquin Phoenix, Robert De Niro, Zazie Beetz",1104931061,55000000,https://www.imdb.com/title/tt7286456/
71,72,Amadeus,1984,8.4,"Biography, Drama, Music",605,88,Milos Forman,Peter Shaffer(original stage play)Zdenek Mahler(uncredited),"F. Murray Abraham, Tom Hulce, Elizabeth Berridge",52066791,18000000,https://www.imdb.com/title/tt0086879/
72,73,Inglourious Basterds,2009,8.3,"Adventure, Drama, War",234,69,Quentin Tarantino,Quentin Tarantino,"Brad Pitt, Diane Kruger, Eli Roth",321457747,70000000,https://www.imdb.com/title/tt0361748/
73,74,Coco,2017,8.4,"Animation, Adventure, Comedy",127,81,Lee UnkrichAdrian Molina(co-directed by),Lee Unkrich(original story by)Jason Katz(original story by)Matthew Aldrich(original story by),"Anthony Gonzalez, Gael García Bernal, Benjamin Bratt",807817888,175000000,https://www.imdb.com/title/tt2380307/
74,75,Toy Story,1995,8.3,"Animation, Adventure, Comedy",653,95,John Lasseter,John Lasseter(original story by)Pete Docter(original story by)Andrew Stanton(original story by),"Tom Hanks, Tim Allen, Don Rickles",394436586,30000000,https://www.imdb.com/title/tt0114709/
75,76,Braveheart,1995,8.4,"Biography, Drama, History",535,68,Mel Gibson,Randall Wallace,"Mel Gibson, Sophie Marceau, Patrick McGoohan",213216216,72000000,https://www.imdb.com/title/tt0112573/
76,77,Das Boot,1981,8.4,"Drama, War",2112,86,Wolfgang Petersen,Wolfgang PetersenLothar G. Buchheim(based on the novel by),"Jürgen Prochnow, Herbert Grönemeyer, Klaus Wennemann",11487676,32000000,https://www.imdb.com/title/tt0082096/
77,78,Avengers: Endgame,2019,8.4,"Action, Adventure, Drama",180,78,Anthony RussoJoe Russo,Christopher Markus(screenplay by)Stephen McFeely(screenplay by)Stan Lee(based on the Marvel comics by),"Robert Downey Jr., Chris Evans, Mark Ruffalo",2797501328,356000000,https://www.imdb.com/title/tt4154796/
78,79,Mononoke-hime,1997,8.4,"Animation, Action, Adventure",1807,76,Hayao Miyazaki,Hayao Miyazaki(original story)Neil Gaiman(adapted by: English version),"Yôji Matsuda, Yuriko Ishida, Yûko Tanaka",170005875,2400000000,https://www.imdb.com/title/tt0119698/
79,80,Once Upon a Time in America,1984,8.3,"Crime, Drama",957,75,Sergio Leone,"Harry Grey(based on novel ""The Hoods"" by)Leonardo Benvenuti(screenplay by)Piero De Bernardi(screenplay by)","Robert De Niro, James Woods, Elizabeth McGovern",5473337,30000000,https://www.imdb.com/title/tt0087843/
80,81,Top Gun: Maverick,2022,8.4,"Action, Drama",28,78,Joseph Kosinski,Jim Cash(based on characters created by)Jack Epps Jr.(based on characters created by)Peter Craig(story by),"Tom Cruise, Jennifer Connelly, Miles Teller",1486657763,170000000,https://www.imdb.com/title/tt1745960/
81,82,Good Will Hunting,1997,8.3,"Drama, Romance",413,70,Gus Van Sant,Matt DamonBen Affleck,"Robin Williams, Matt Damon, Ben Affleck",225933435,10000000,https://www.imdb.com/title/tt0119217/
82,83,Kimi no na wa.,2016,8.4,"Animation, Drama, Fantasy",853,79,Makoto Shinkai,Makoto Shinkai(based on his novel)Clark Cheng(english script),"Ryûnosuke Kamiki, Mone Kamishiraishi, Ryô Narita",358180115,370000000,https://www.imdb.com/title/tt5311514/
83,84,Requiem for a Dream,2000,8.3,Drama,356,68,Darren Aronofsky,Hubert Selby Jr.(based on the book by)Darren Aronofsky(screenplay),"Ellen Burstyn, Jared Leto, Jennifer Connelly",7390108,4500000,https://www.imdb.com/title/tt0180093/
84,85,Toy Story 3,2010,8.3,"Animation, Adventure, Comedy",1715,92,Lee Unkrich,John Lasseter(story by)Andrew Stanton(story by)Lee Unkrich(story by),"Tom Hanks, Tim Allen, Joan Cusack",1066970811,200000000,https://www.imdb.com/title/tt0435761/
85,86,Singin' in the Rain,1952,8.3,"Comedy, Musical, Romance",820,99,Stanley DonenGene Kelly,Betty Comden(story by)Adolph Green(story by),"Gene Kelly, Donald O'Connor, Debbie Reynolds",1985921,2540800,https://www.imdb.com/title/tt0045152/
86,87,3 Idiots,2009,8.4,"Comedy, Drama",1158,67,Rajkumar Hirani,Rajkumar Hirani(screenplay)Abhijat Joshi(screenplay)Vidhu Vinod Chopra(screenplay associate),"Aamir Khan, Madhavan, Mona Singh",60262836,550000000,https://www.imdb.com/title/tt1187043/
87,88,Tengoku to jigoku,1963,8.4,"Crime, Drama, Mystery",0,90,Akira Kurosawa,Hideo Oguni(screenplay)Ryûzô Kikushima(screenplay)Eijirô Hisaita(screenplay),"Toshirô Mifune, Yutaka Sada, Tatsuya Nakadai",46808,0,https://www.imdb.com/title/tt0057565/
88,89,Star Wars: Episode VI - Return of the Jedi,1983,8.3,"Action, Adventure, Fantasy",1153,58,Richard Marquand,Lawrence Kasdan(screenplay by)George Lucas(screenplay by),"Mark Hamill, Harrison Ford, Carrie Fisher",475106177,32500000,https://www.imdb.com/title/tt0086190/
89,90,Eternal Sunshine of the Spotless Mind,2004,8.3,"Drama, Romance, Sci-Fi",452,89,Michel Gondry,Charlie Kaufman(story)Michel Gondry(story)Pierre Bismuth(story),"Jim Carrey, Kate Winslet, Tom Wilkinson",74036715,20000000,https://www.imdb.com/title/tt0338013/
90,91,2001: A Space Odyssey,1968,8.3,"Adventure, Sci-Fi",626,84,Stanley Kubrick,Stanley Kubrick(screenplay by)Arthur C. Clarke(screenplay by),"Keir Dullea, Gary Lockwood, William Sylvester",65886138,12000000,https://www.imdb.com/title/tt0062622/
91,92,Capharnaüm,2018,8.4,Drama,1542,75,Nadine Labaki,Nadine Labaki(screenplay)Jihad Hojeily(screenplay)Michelle Keserwany(screenplay),"Zain Al Rafeea, Yordanos Shiferaw, Boluwatife Treasure Bankole",64417003,4000000,https://www.imdb.com/title/tt8267604/
92,93,Reservoir Dogs,1992,8.3,"Crime, Thriller",665,79,Quentin Tarantino,Quentin Tarantino(background radio dialogue written by)Roger Avary(background radio dialogue written by),"Harvey Keitel, Tim Roth, Michael Madsen",2913644,1200000,https://www.imdb.com/title/tt0105236/
93,94,Jagten,2012,8.3,Drama,566,77,Thomas Vinterberg,Thomas Vinterberg(screenplay)Tobias Lindholm(screenplay),"Mads Mikkelsen, Thomas Bo Larsen, Annika Wedderkopp",15886373,3800000,https://www.imdb.com/title/tt2106476/
94,95,Citizen Kane,1941,8.3,"Drama, Mystery",1735,100,Orson Welles,Herman J. Mankiewicz(original screen play)Orson Welles(original screen play)John Houseman(contributing writer),"Orson Welles, Joseph Cotten, Dorothy Comingore",1645133,839727,https://www.imdb.com/title/tt0033467/
95,96,M - Eine Stadt sucht einen Mörder,1931,8.3,"Crime, Mystery, Thriller",2726,0,Fritz Lang,Thea von Harbou(script)Fritz Lang(script)Egon Jacobsohn(article),"Peter Lorre, Ellen Widmann, Inge Landgut",35566,0,https://www.imdb.com/title/tt0022100/
96,97,Idi i smotri,1985,8.4,"Drama, Thriller, War",641,0,Elem Klimov,Ales Adamovich(story)Elem Klimov(screenplay),"Aleksey Kravchenko, Olga Mironova, Liubomiras Laucevicius",20929648,0,https://www.imdb.com/title/tt0091251/
97,98,Lawrence of Arabia,1962,8.3,"Adventure, Biography, Drama",1315,100,David Lean,Robert Bolt(screenplay by)Michael Wilson(screenplay by),"Peter O'Toole, Alec Guinness, Anthony Quinn",45716692,15000000,https://www.imdb.com/title/tt0056172/
98,99,North by Northwest,1959,8.3,"Action, Adventure, Mystery",1630,98,Alfred Hitchcock,Ernest Lehman,"Cary Grant, Eva Marie Saint, James Mason",142319,3101000,https://www.imdb.com/title/tt0053125/
99,100,Vertigo,1958,8.3,"Mystery, Romance, Thriller",1716,100,Alfred Hitchcock,"Alec Coppel(screenplay by)Samuel A. Taylor(screenplay by)Pierre Boileau(based on the novel ""D'Entre Les Morts"" by)","James Stewart, Kim Novak, Barbara Bel Geddes",7798000,2479000,https://www.imdb.com/title/tt0052357/
100,101,Le fabuleux destin d'Amélie Poulain,2001,8.3,"Comedy, Romance",1085,69,Jean-Pierre Jeunet,Guillaume Laurant(scenario)Jean-Pierre Jeunet(scenario),"Audrey Tautou, Mathieu Kassovitz, Rufus",174122191,10000000,https://www.imdb.com/title/tt0211915/
101,102,A Clockwork Orange,1971,8.3,"Crime, Sci-Fi",316,77,Stanley Kubrick,Stanley Kubrick(screenplay)Anthony Burgess(novel),"Malcolm McDowell, Patrick Magee, Michael Bates",26960374,2200000,https://www.imdb.com/title/tt0066921/
102,103,The Apartment,1960,8.3,"Comedy, Drama, Romance",3448,94,Billy Wilder,Billy WilderI.A.L. Diamond,"Jack Lemmon, Shirley MacLaine, Fred MacMurray",18778738,3000000,https://www.imdb.com/title/tt0053604/
103,104,Double Indemnity,1944,8.3,"Crime, Drama, Film-Noir",3917,95,Billy Wilder,Billy Wilder(screenplay)Raymond Chandler(screenplay)James M. Cain(from the novel by),"Fred MacMurray, Barbara Stanwyck, Edward G. Robinson",14651,927262,https://www.imdb.com/title/tt0036775/
104,105,Ikiru,1952,8.3,Drama,3287,91,Akira Kurosawa,Akira KurosawaShinobu HashimotoHideo Oguni,"Takashi Shimura, Nobuo Kaneko, Shin'ichi Himori",96302,0,https://www.imdb.com/title/tt0044741/
105,106,Full Metal Jacket,1987,8.3,"Drama, War",561,76,Stanley Kubrick,Stanley Kubrick(screenplay by)Michael Herr(screenplay by)Gustav Hasford(screenplay by),"Matthew Modine, R. Lee Ermey, Vincent D'Onofrio",46357676,30000000,https://www.imdb.com/title/tt0093058/
